{
  "schema_version": "0.1.0",
  "profile_id": "469bdbfe-3940-4870-a914-ea02aeabf149",
  "created_at": "2026-09-12T20:00:00Z",
  "updated_at": "2026-09-12T20:10:00Z",
  "generator": {
    "name": "Preference Intelligence",
    "version": "0.1.0"
  },
  "settings": {
    "learning_enabled": true,
    "raw_evidence_included": false,
    "disabled_scopes": []
  },
  "preferences": [
    {
      "preference_id": "d63d0f03-b5b7-4b21-9d88-a9294a1d3329",
      "dimension": "verbosity",
      "value": "concise",
      "scope": {
        "domain": null,
        "subdomain": null,
        "task": null
      },
      "confidence": 0.84,
      "state": "confirmed",
      "source_type": "user_explicit",
      "evidence_count": 2,
      "independent_interaction_count": 2,
      "created_at": "2026-09-12T20:00:00Z",
      "updated_at": "2026-09-12T20:10:00Z",
      "last_observed_at": "2026-09-12T20:10:00Z",
      "expires_at": null,
      "decay": {
        "mode": "none",
        "half_life_days": null
      },
      "user_locked": false,
      "evidence": [],
      "provenance": [
        {
          "actor": "user",
          "component": "preference-dashboard",
          "version": "0.1.0",
          "recorded_at": "2026-09-12T20:10:00Z"
        }
      ]
    },
    {
      "preference_id": "23424e24-7eb1-4d78-b637-8d5216d46277",
      "dimension": "technical_depth",
      "value": "advanced",
      "scope": {
        "domain": "software_engineering",
        "subdomain": "backend",
        "task": null
      },
      "confidence": 0.92,
      "state": "locked",
      "source_type": "dashboard_edit",
      "evidence_count": 1,
      "independent_interaction_count": 1,
      "created_at": "2026-09-12T20:05:00Z",
      "updated_at": "2026-09-12T20:05:00Z",
      "last_observed_at": "2026-09-12T20:05:00Z",
      "expires_at": null,
      "decay": {
        "mode": "none",
        "half_life_days": null
      },
      "user_locked": true,
      "evidence": [],
      "provenance": [
        {
          "actor": "user",
          "component": "preference-dashboard",
          "version": "0.1.0",
          "recorded_at": "2026-09-12T20:05:00Z"
        }
      ]
    },
    {
      "preference_id": "7395378c-26c6-4aee-8dc9-df42766544fe",
      "dimension": "explanation_level",
      "value": "beginner",
      "scope": {
        "domain": "finance",
        "subdomain": null,
        "task": "explanation"
      },
      "confidence": 0.78,
      "state": "confirmed",
      "source_type": "dashboard_edit",
      "evidence_count": 1,
      "independent_interaction_count": 1,
      "created_at": "2026-09-12T20:08:00Z",
      "updated_at": "2026-09-12T20:08:00Z",
      "last_observed_at": "2026-09-12T20:08:00Z",
      "expires_at": null,
      "decay": {
        "mode": "none",
        "half_life_days": null
      },
      "user_locked": false,
      "evidence": [],
      "provenance": [
        {
          "actor": "user",
          "component": "preference-dashboard",
          "version": "0.1.0",
          "recorded_at": "2026-09-12T20:08:00Z"
        }
      ]
    }
  ]
}
